{
  "schemaVersion": "1.0.0",
  "policyVersion": "dataset-evidence-v1",
  "policyDigest": "sha256:fd064a9687b280eb88518eed0812f16e8c07054814108eb613cfe61ace02782c",
  "datasets": [
    {
      "id": "industrial-vision-prototype-synthetic-fixture",
      "kind": "synthetic",
      "fixturePaths": [
        "tests/prototypes/industrial-vision/source-v1.json",
        "tests/prototypes/industrial-vision/checkpoints-v1.json"
      ],
      "fixtureSha256": "sha256:1275de034ce39f2f398f201c29585fdfb7497bea91ef75a6b98202f9c253956c",
      "deterministic": true,
      "attribution": "Generated in this repository for a non-public Media-and-AI architecture prototype; no camera, customer, transcript, or third-party records are used.",
      "transformationRecord": "The pinned generator emits synthetic media descriptors and curated custom-model envelopes, executes a deterministic local escalation policy, and records exact expected checkpoints without creating image data.",
      "redistributionScope": "repository-and-public-build",
      "dataRightsVerdict": "allowed",
      "piiScan": {
        "tool": "industrial-vision prototype structural assertions",
        "command": "npx tsx --test tests/portfolio/industrial-vision-prototype.test.ts",
        "result": "PASS",
        "checkedAt": "2026-07-18"
      },
      "syntheticDataScan": {
        "tool": "industrial-vision deterministic fixture generator",
        "command": "npx tsx scripts/portfolio/industrial-vision-prototype.ts",
        "result": "PASS",
        "checkedAt": "2026-07-18"
      },
      "generation": {
        "command": "npx tsx scripts/portfolio/industrial-vision-prototype.ts --write",
        "generatorPath": "scripts/portfolio/industrial-vision-prototype.ts",
        "generatorSha256": "sha256:f5614d99d4a2709d6e44ac9db3d22d054f262cb2d300980dd4eb6a7a43c112fa",
        "seed": "industrial-vision-media-ai-spine-synthetic-v1"
      }
    }
  ]
}
