{
  "schemaVersion": "1.0.0",
  "policyVersion": "dataset-evidence-v1",
  "policyDigest": "sha256:fd064a9687b280eb88518eed0812f16e8c07054814108eb613cfe61ace02782c",
  "datasets": [
    {
      "id": "remove-pii-synthetic-fixture",
      "kind": "synthetic",
      "fixturePaths": [
        "examples/data-security/remove-pii/sample-data.json",
        "examples/data-security/remove-pii/fixture-environment.json",
        "examples/data-security/remove-pii/expected-output.jsonl"
      ],
      "fixtureSha256": "sha256:6a16c0d9ffce722d81760aec5f92bb8a0f678bcd8a0ee9ad0c31406f08d276c3",
      "deterministic": true,
      "attribution": "Generated in this repository for the Remove PII example; no customer or third-party records are used.",
      "transformationRecord": "The generator builds a fictional purchase event, applies the documented deterministic HMAC and field-removal transformations, and binds the exact fixture environment and output bytes.",
      "redistributionScope": "repository-and-public-build",
      "dataRightsVerdict": "allowed",
      "piiScan": {
        "tool": "remove-pii deterministic fixture generator",
        "command": "npx tsx scripts/fixtures/generate-remove-pii-fixture.ts",
        "result": "PASS",
        "checkedAt": "2026-07-18"
      },
      "syntheticDataScan": {
        "tool": "remove-pii deterministic fixture generator",
        "command": "npx tsx scripts/fixtures/generate-remove-pii-fixture.ts",
        "result": "PASS",
        "checkedAt": "2026-07-18"
      },
      "generation": {
        "command": "npx tsx scripts/fixtures/generate-remove-pii-fixture.ts --write",
        "generatorPath": "scripts/fixtures/generate-remove-pii-fixture.ts",
        "generatorSha256": "sha256:f89320bcef5786c911f32b06b5060a34aaa539bb1a91b03e4a190977c721d4e6",
        "seed": "remove-pii-synthetic-fixture-v1"
      }
    },
    {
      "id": "medical-device-intelligence-synthetic-fixture",
      "kind": "synthetic",
      "fixturePaths": [
        "examples/integrations/medical-device-intelligence/error-events.json",
        "examples/integrations/medical-device-intelligence/maintenance-logs.csv",
        "examples/integrations/medical-device-intelligence/technician-notes.txt"
      ],
      "fixtureSha256": "sha256:aa4c4e97cc8fa3a762f53b1bca53b520b66908e6fe13e3705a827a1900f5d13e",
      "deterministic": true,
      "attribution": "Generated in this repository for the Medical Device Field Report Intelligence architecture; no customer, patient, or third-party records are used.",
      "transformationRecord": "The generator emits three compact fictional sources with aliases, test device ids, synthetic adapter statuses, and explicit non-customer labeling.",
      "redistributionScope": "repository-and-public-build",
      "dataRightsVerdict": "allowed",
      "piiScan": {
        "tool": "medical-device deterministic fixture generator",
        "command": "npx tsx scripts/fixtures/generate-medical-device-fixture.ts",
        "result": "PASS",
        "checkedAt": "2026-07-18"
      },
      "syntheticDataScan": {
        "tool": "medical-device deterministic fixture generator",
        "command": "npx tsx scripts/fixtures/generate-medical-device-fixture.ts",
        "result": "PASS",
        "checkedAt": "2026-07-18"
      },
      "generation": {
        "command": "npx tsx scripts/fixtures/generate-medical-device-fixture.ts --write",
        "generatorPath": "scripts/fixtures/generate-medical-device-fixture.ts",
        "generatorSha256": "sha256:54dd54f6a7c94537fc4899670b475203cfbfa1331932727f963897e23603c75b",
        "seed": "medical-device-intelligence-synthetic-fixture-v1"
      }
    },
    {
      "id": "scada-energy-edge-synthetic-fixture",
      "kind": "synthetic",
      "fixturePaths": ["examples/integrations/scada-energy-edge/input.txt"],
      "fixtureSha256": "sha256:247a2eb2be418ea2e3ee378e981edabe93f547f5c457b694701698edd9885220",
      "deterministic": true,
      "attribution": "Generated in this repository for the SCADA Energy Edge example; no customer or third-party telemetry is used.",
      "transformationRecord": "The generator emits a fixed set of fictional, adapter-decoded register records covering nominal readings and illustrative status changes.",
      "redistributionScope": "repository-and-public-build",
      "dataRightsVerdict": "allowed",
      "piiScan": {
        "tool": "scada deterministic fixture generator",
        "command": "npx tsx scripts/fixtures/generate-scada-fixture.ts",
        "result": "PASS",
        "checkedAt": "2026-07-18"
      },
      "syntheticDataScan": {
        "tool": "scada deterministic fixture generator",
        "command": "npx tsx scripts/fixtures/generate-scada-fixture.ts",
        "result": "PASS",
        "checkedAt": "2026-07-18"
      },
      "generation": {
        "command": "npx tsx scripts/fixtures/generate-scada-fixture.ts --write",
        "generatorPath": "scripts/fixtures/generate-scada-fixture.ts",
        "generatorSha256": "sha256:98ba1456aa00932ea5e853908cb44f3f3110c9c714f681fbe6dae73618645093",
        "seed": "scada-energy-edge-synthetic-fixture-v1"
      }
    },
    {
      "id": "foundation-synthetic-fixtures",
      "kind": "synthetic",
      "fixturePaths": [
        "examples/data-routing/input.yaml",
        "examples/data-security/input.json",
        "examples/data-security/output.json",
        "examples/data-transformation/input.json",
        "examples/data-transformation/input.jsonl",
        "examples/enterprise-migration/db2-to-bigquery/sample-input.json",
        "examples/enterprise-migration/db2-to-bigquery/sample-output.json",
        "examples/integrations/oran-input.yaml",
        "examples/integrations/splunk-input.yaml",
        "examples/log-processing/input.yaml",
        "examples/log-processing/output.jsonl"
      ],
      "fixtureSha256": "sha256:ab4ce77bd3ce04d0291cb6e5ab7f20e3e8690360fc5b20ee2a3588c550c70e50",
      "deterministic": true,
      "attribution": "Generated in this repository as compact fictional configuration and record fixtures; no customer or third-party data is used.",
      "transformationRecord": "The generator preserves the exact synthetic input, output, and integration configuration bytes used by the legacy example families while their execution evidence remains unassessed.",
      "redistributionScope": "repository-and-public-build",
      "dataRightsVerdict": "allowed",
      "piiScan": {
        "tool": "foundation deterministic fixture generator",
        "command": "npx tsx scripts/fixtures/generate-foundation-fixtures.ts",
        "result": "PASS",
        "checkedAt": "2026-07-18"
      },
      "syntheticDataScan": {
        "tool": "foundation deterministic fixture generator",
        "command": "npx tsx scripts/fixtures/generate-foundation-fixtures.ts",
        "result": "PASS",
        "checkedAt": "2026-07-18"
      },
      "generation": {
        "command": "npx tsx scripts/fixtures/generate-foundation-fixtures.ts --write",
        "generatorPath": "scripts/fixtures/generate-foundation-fixtures.ts",
        "generatorSha256": "sha256:c94f28033148e9c737bb2755b4b4f3d14db1b55b8c7b41ef9a629793284e0df1",
        "seed": "foundation-synthetic-fixtures-v1"
      }
    },
    {
      "id": "explorer-stage-synthetic-fixtures",
      "kind": "synthetic",
      "fixturePaths": [
        "examples/data-security/cross-border-gdpr/sample-input.json",
        "examples/enterprise-migration/nightly-backup/sample-input.json",
        "examples/integrations/motherduck-retail-analytics/sample-pos-events.jsonl"
      ],
      "fixtureSha256": "sha256:e0c89591860555411fbf6a270d532c5dae49b4321984e8512f47303d1eb2f5b7",
      "deterministic": true,
      "attribution": "Generated in this repository as compact fictional sample inputs for the nightly-backup, cross-border-gdpr, and motherduck-retail-analytics Explorer stage families; no customer or third-party data is used.",
      "transformationRecord": "The generator pins the exact synthetic input bytes that were run through expanso-edge Local Mode to author the stage checkpoints; the MotherDuck events were captured once from the pipeline's own generate input and are now fixed.",
      "redistributionScope": "repository-and-public-build",
      "dataRightsVerdict": "allowed",
      "piiScan": {
        "tool": "explorer-stage deterministic fixture generator",
        "command": "npx tsx scripts/fixtures/generate-explorer-stage-fixtures.ts",
        "result": "PASS",
        "checkedAt": "2026-10-05"
      },
      "syntheticDataScan": {
        "tool": "explorer-stage deterministic fixture generator",
        "command": "npx tsx scripts/fixtures/generate-explorer-stage-fixtures.ts",
        "result": "PASS",
        "checkedAt": "2026-10-05"
      },
      "generation": {
        "command": "npx tsx scripts/fixtures/generate-explorer-stage-fixtures.ts --write",
        "generatorPath": "scripts/fixtures/generate-explorer-stage-fixtures.ts",
        "generatorSha256": "sha256:eb1fcaaa718bb10e62c11fe7934b4b8f72287172ac1a98df092dc34949b42375",
        "seed": "explorer-stage-synthetic-fixtures-v1"
      }
    }
  ]
}
